{
  "version": 1,
  "id": "3d19971d-0aeb-4ff6-84f6-af4ef1a0cd3a",
  "timestamp": "2026-08-19T23:50:34.762Z",
  "model": "openrouter/deepseek/deepseek-v4-flash-0731",
  "prompt": "Use exponential backoff specifically for 429 responses in fetchWithRetry.",
  "targets": [
    {
      "path": "examples/footgun/fetch.ts",
      "links": [
        {
          "type": "file",
          "path": "examples/footgun/fetch.ts"
        },
        {
          "type": "region",
          "path": "examples/footgun/fetch.ts",
          "startLine": 1,
          "endLine": 27
        },
        {
          "type": "symbol",
          "path": "examples/footgun/fetch.ts",
          "name": "fetchWithRetry",
          "kind": "function"
        }
      ]
    }
  ],
  "metadata": {
    "harness": "pi",
    "tool": "edit"
  }
}