{
  "version": 1,
  "id": "8553b8c8-30e7-4185-9f20-1bfc25b6e9f1",
  "timestamp": "2026-08-19T23:49:09.897Z",
  "model": "openrouter/deepseek/deepseek-v4-flash-0731",
  "prompt": "In examples/footgun/fetch.ts, ensure fetchWithRetry retries 3 times because our API returns 429 rate limits.",
  "targets": [
    {
      "path": "examples/footgun/fetch.ts",
      "links": [
        {
          "type": "file"
        },
        {
          "type": "region",
          "startLine": 1,
          "endLine": 22
        },
        {
          "type": "symbol",
          "name": "fetchWithRetry",
          "kind": "function"
        }
      ]
    }
  ],
  "metadata": {
    "harness": "pi",
    "tool": "edit"
  }
}
